"No.","Time","Source","Destination","Protocol","Length","Info"
"1","0.000000","192.144.198.149","DESKTOP-P07SKIO","TCP","60","7823  >  55911 [ACK] Seq=1 Ack=1 Win=60 Len=0"
"2","0.000198","192.144.198.149","DESKTOP-P07SKIO","TLSv1.2","191","Server Hello, Change Cipher Spec, Encrypted Handshake Message"
"3","0.001299","DESKTOP-P07SKIO","116.211.94.3","TCP","54","55903  >  https(443) [ACK] Seq=1 Ack=1 Win=509 Len=0"
"4","0.001383","DESKTOP-P07SKIO","192.144.198.149","TLSv1.2","105","Change Cipher Spec, Encrypted Handshake Message"
"5","0.004140","DESKTOP-P07SKIO","180.163.230.244","UDP","50","scp-config(10001)  >  http(80) Len=8"
"6","0.013370","DESKTOP-P07SKIO","192.144.198.149","TLSv1.2","1005","Application Data"
"7","0.030063","101.4.132.22","DESKTOP-P07SKIO","TCP","1514","https(443)  >  55819 [ACK] Seq=1 Ack=1 Win=32 Len=1460 [TCP segment of a reassembled PDU]"
"8","0.031401","101.4.132.22","DESKTOP-P07SKIO","TCP","1514","https(443)  >  55819 [ACK] Seq=1461 Ack=1 Win=32 Len=1460 [TCP segment of a reassembled PDU]"
"9","0.031412","101.4.132.22","DESKTOP-P07SKIO","TLSv1.2","1259","Application Data"
"10","0.031414","101.4.132.22","DESKTOP-P07SKIO","TCP","1514","https(443)  >  55819 [ACK] Seq=4126 Ack=1 Win=32 Len=1460 [TCP segment of a reassembled PDU]"
"11","0.031419","101.4.132.22","DESKTOP-P07SKIO","TCP","1514","https(443)  >  55819 [ACK] Seq=5586 Ack=1 Win=32 Len=1460 [TCP segment of a reassembled PDU]"
"12","0.031421","101.4.132.22","DESKTOP-P07SKIO","TLSv1.2","1259","Application Data"
"13","0.031424","101.4.132.22","DESKTOP-P07SKIO","TCP","1514","https(443)  >  55819 [ACK] Seq=8251 Ack=1 Win=32 Len=1460 [TCP segment of a reassembled PDU]"
"14","0.031426","101.4.132.22","DESKTOP-P07SKIO","TCP","1514","https(443)  >  55819 [ACK] Seq=9711 Ack=1 Win=32 Len=1460 [TCP segment of a reassembled PDU]"
"15","0.031429","101.4.132.22","DESKTOP-P07SKIO","TLSv1.2","1514","Application Data [TCP segment of a reassembled PDU]"
"16","0.031431","101.4.132.22","DESKTOP-P07SKIO","TCP","1514","https(443)  >  55819 [ACK] Seq=12631 Ack=1 Win=32 Len=1460 [TCP segment of a reassembled PDU]"
"17","0.031433","101.4.132.22","DESKTOP-P07SKIO","TCP","1514","https(443)  >  55819 [ACK] Seq=14091 Ack=1 Win=32 Len=1460 [TCP segment of a reassembled PDU]"
"18","0.031437","101.4.132.22","DESKTOP-P07SKIO","TLSv1.2","1004","Application Data"
"19","0.031440","101.4.132.22","DESKTOP-P07SKIO","TCP","1514","https(443)  >  55819 [ACK] Seq=16501 Ack=1 Win=32 Len=1460 [TCP segment of a reassembled PDU]"
"20","0.031443","101.4.132.22","DESKTOP-P07SKIO","TCP","1514","https(443)  >  55819 [ACK] Seq=17961 Ack=1 Win=32 Len=1460 [TCP segment of a reassembled PDU]"
"21","0.031446","101.4.132.22","DESKTOP-P07SKIO","TLSv1.2","1514","Application Data [TCP segment of a reassembled PDU]"
"22","0.031449","101.4.132.22","DESKTOP-P07SKIO","TCP","1514","https(443)  >  55819 [ACK] Seq=20881 Ack=1 Win=32 Len=1460 [TCP segment of a reassembled PDU]"
"23","0.031452","101.4.132.22","DESKTOP-P07SKIO","TCP","1514","https(443)  >  55819 [ACK] Seq=22341 Ack=1 Win=32 Len=1460 [TCP segment of a reassembled PDU]"
"24","0.031998","DESKTOP-P07SKIO","101.4.132.22","TCP","54","55819  >  https(443) [ACK] Seq=1 Ack=23801 Win=18580 Len=0"
"25","0.034258","101.4.132.22","DESKTOP-P07SKIO","TLSv1.2","1514","Application Data [TCP segment of a reassembled PDU]"
"26","0.034271","101.4.132.22","DESKTOP-P07SKIO","TCP","1514","https(443)  >  55819 [ACK] Seq=25261 Ack=1 Win=32 Len=1460 [TCP segment of a reassembled PDU]"
"27","0.034275","101.4.132.22","DESKTOP-P07SKIO","TCP","1514","https(443)  >  55819 [ACK] Seq=26721 Ack=1 Win=32 Len=1460 [TCP segment of a reassembled PDU]"
"28","0.034278","101.4.132.22","DESKTOP-P07SKIO","TLSv1.2","749","Application Data"
"29","0.034281","101.4.132.22","DESKTOP-P07SKIO","TCP","1514","https(443)  >  55819 [ACK] Seq=28876 Ack=1 Win=32 Len=1460 [TCP segment of a reassembled PDU]"
"30","0.034285","101.4.132.22","DESKTOP-P07SKIO","TCP","1514","https(443)  >  55819 [ACK] Seq=30336 Ack=1 Win=32 Len=1460 [TCP segment of a reassembled PDU]"
"31","0.034287","101.4.132.22","DESKTOP-P07SKIO","TLSv1.2","1514","Application Data [TCP segment of a reassembled PDU]"
"32","0.034291","101.4.132.22","DESKTOP-P07SKIO","TCP","1514","https(443)  >  55819 [ACK] Seq=33256 Ack=1 Win=32 Len=1460 [TCP segment of a reassembled PDU]"
"33","0.034294","101.4.132.22","DESKTOP-P07SKIO","TCP","1514","https(443)  >  55819 [ACK] Seq=34716 Ack=1 Win=32 Len=1460 [TCP segment of a reassembled PDU]"
"34","0.034297","101.4.132.22","DESKTOP-P07SKIO","TLSv1.2","1514","Application Data [TCP segment of a reassembled PDU]"
"35","0.034300","101.4.132.22","DESKTOP-P07SKIO","TCP","1514","https(443)  >  55819 [ACK] Seq=37636 Ack=1 Win=32 Len=1460 [TCP segment of a reassembled PDU]"
"36","0.034302","101.4.132.22","DESKTOP-P07SKIO","TCP","1514","https(443)  >  55819 [ACK] Seq=39096 Ack=1 Win=32 Len=1460 [TCP segment of a reassembled PDU]"
"37","0.034305","101.4.132.22","DESKTOP-P07SKIO","TLSv1.2","1514","Application Data [TCP segment of a reassembled PDU]"
"38","0.034308","101.4.132.22","DESKTOP-P07SKIO","TCP","1514","https(443)  >  55819 [ACK] Seq=42016 Ack=1 Win=32 Len=1460 [TCP segment of a reassembled PDU]"
"39","0.034310","101.4.132.22","DESKTOP-P07SKIO","TCP","1514","https(443)  >  55819 [ACK] Seq=43476 Ack=1 Win=32 Len=1460 [TCP segment of a reassembled PDU]"
"40","0.034313","101.4.132.22","DESKTOP-P07SKIO","TLSv1.2","1514","Application Data [TCP segment of a reassembled PDU]"
"41","0.034316","101.4.132.22","DESKTOP-P07SKIO","TCP","1514","https(443)  >  55819 [ACK] Seq=46396 Ack=1 Win=32 Len=1460 [TCP segment of a reassembled PDU]"
"42","0.034320","101.4.132.22","DESKTOP-P07SKIO","TCP","1514","https(443)  >  55819 [ACK] Seq=47856 Ack=1 Win=32 Len=1460 [TCP segment of a reassembled PDU]"
"43","0.034324","101.4.132.22","DESKTOP-P07SKIO","TLSv1.2","1514","Application Data [TCP segment of a reassembled PDU]"
"44","0.034327","101.4.132.22","DESKTOP-P07SKIO","TCP","1514","https(443)  >  55819 [ACK] Seq=50776 Ack=1 Win=32 Len=1460 [TCP segment of a reassembled PDU]"
"45","0.034329","101.4.132.22","DESKTOP-P07SKIO","TLSv1.2","1444","Application Data"
"46","0.034333","101.4.132.22","DESKTOP-P07SKIO","TCP","1514","https(443)  >  55819 [ACK] Seq=53626 Ack=1 Win=32 Len=1460 [TCP segment of a reassembled PDU]"
"47","0.034336","101.4.132.22","DESKTOP-P07SKIO","TCP","1514","https(443)  >  55819 [ACK] Seq=55086 Ack=1 Win=32 Len=1460 [TCP segment of a reassembled PDU]"
"48","0.034339","101.4.132.22","DESKTOP-P07SKIO","TLSv1.2","1514","Application Data [TCP segment of a reassembled PDU]"
"49","0.034343","101.4.132.22","DESKTOP-P07SKIO","TCP","1514","https(443)  >  55819 [ACK] Seq=58006 Ack=1 Win=32 Len=1460 [TCP segment of a reassembled PDU]"
"50","0.034346","101.4.132.22","DESKTOP-P07SKIO","TCP","1514","https(443)  >  55819 [ACK] Seq=59466 Ack=1 Win=32 Len=1460 [TCP segment of a reassembled PDU]"
"51","0.034349","101.4.132.22","DESKTOP-P07SKIO","TLSv1.2","1514","Application Data [TCP segment of a reassembled PDU]"
"52","0.034351","101.4.132.22","DESKTOP-P07SKIO","TCP","1514","https(443)  >  55819 [ACK] Seq=62386 Ack=1 Win=32 Len=1460 [TCP segment of a reassembled PDU]"
"53","0.034354","101.4.132.22","DESKTOP-P07SKIO","TCP","1514","https(443)  >  55819 [ACK] Seq=63846 Ack=1 Win=32 Len=1460 [TCP segment of a reassembled PDU]"
"54","0.034357","101.4.132.22","DESKTOP-P07SKIO","TLSv1.2","749","Application Data"
"55","0.035315","DESKTOP-P07SKIO","101.4.132.22","TCP","54","55819  >  https(443) [ACK] Seq=1 Ack=66001 Win=18580 Len=0"
"56","0.071785","192.144.198.149","DESKTOP-P07SKIO","TCP","60","7823  >  55911 [ACK] Seq=138 Ack=1003 Win=63 Len=0"
"57","0.072156","192.144.198.149","DESKTOP-P07SKIO","TLSv1.2","212","Application Data"
"58","0.085815","DESKTOP-P07SKIO","192.144.198.149","TLSv1.2","142","Application Data"
"59","0.086495","DESKTOP-P07SKIO","192.144.198.149","TLSv1.2","125","Application Data"
"60","0.089196","DESKTOP-P07SKIO","116.211.94.3","TLSv1.2","1216","Application Data"
"61","0.091855","DESKTOP-P07SKIO","116.211.94.3","TLSv1.2","1214","Application Data"
"62","0.117401","101.4.132.22","DESKTOP-P07SKIO","TCP","1514","https(443)  >  55819 [ACK] Seq=66001 Ack=1 Win=32 Len=1460 [TCP segment of a reassembled PDU]"
"63","0.118601","101.4.132.22","DESKTOP-P07SKIO","TCP","1514","https(443)  >  55819 [ACK] Seq=67461 Ack=1 Win=32 Len=1460 [TCP segment of a reassembled PDU]"
"64","0.118612","101.4.132.22","DESKTOP-P07SKIO","TLSv1.2","1259","Application Data"
"65","0.118615","101.4.132.22","DESKTOP-P07SKIO","TCP","1514","https(443)  >  55819 [ACK] Seq=70126 Ack=1 Win=32 Len=1460 [TCP segment of a reassembled PDU]"
"66","0.118620","101.4.132.22","DESKTOP-P07SKIO","TCP","1514","https(443)  >  55819 [ACK] Seq=71586 Ack=1 Win=32 Len=1460 [TCP segment of a reassembled PDU]"
"67","0.118623","101.4.132.22","DESKTOP-P07SKIO","TLSv1.2","1259","Application Data"
"68","0.118625","101.4.132.22","DESKTOP-P07SKIO","TCP","1514","https(443)  >  55819 [ACK] Seq=74251 Ack=1 Win=32 Len=1460 [TCP segment of a reassembled PDU]"
"69","0.118628","101.4.132.22","DESKTOP-P07SKIO","TCP","1514","https(443)  >  55819 [ACK] Seq=75711 Ack=1 Win=32 Len=1460 [TCP segment of a reassembled PDU]"
"70","0.118632","101.4.132.22","DESKTOP-P07SKIO","TLSv1.2","1514","Application Data [TCP segment of a reassembled PDU]"
"71","0.118634","101.4.132.22","DESKTOP-P07SKIO","TCP","1514","https(443)  >  55819 [ACK] Seq=78631 Ack=1 Win=32 Len=1460 [TCP segment of a reassembled PDU]"
"72","0.118638","101.4.132.22","DESKTOP-P07SKIO","TCP","1514","https(443)  >  55819 [ACK] Seq=80091 Ack=1 Win=32 Len=1460 [TCP segment of a reassembled PDU]"
"73","0.118642","101.4.132.22","DESKTOP-P07SKIO","TLSv1.2","1004","Application Data"
"74","0.119125","DESKTOP-P07SKIO","101.4.132.22","TCP","54","55819  >  https(443) [ACK] Seq=1 Ack=82501 Win=18580 Len=0"
"75","0.123356","101.4.132.22","DESKTOP-P07SKIO","TCP","1514","https(443)  >  55819 [ACK] Seq=82501 Ack=1 Win=32 Len=1460 [TCP segment of a reassembled PDU]"
"76","0.123371","101.4.132.22","DESKTOP-P07SKIO","TCP","1514","https(443)  >  55819 [ACK] Seq=83961 Ack=1 Win=32 Len=1460 [TCP segment of a reassembled PDU]"
"77","0.123376","101.4.132.22","DESKTOP-P07SKIO","TLSv1.2","1514","Application Data [TCP segment of a reassembled PDU]"
"78","0.123381","101.4.132.22","DESKTOP-P07SKIO","TCP","1514","https(443)  >  55819 [ACK] Seq=86881 Ack=1 Win=32 Len=1460 [TCP segment of a reassembled PDU]"
"79","0.123384","101.4.132.22","DESKTOP-P07SKIO","TCP","1514","https(443)  >  55819 [ACK] Seq=88341 Ack=1 Win=32 Len=1460 [TCP segment of a reassembled PDU]"
"80","0.123387","101.4.132.22","DESKTOP-P07SKIO","TLSv1.2","1514","Application Data [TCP segment of a reassembled PDU]"
"81","0.123390","101.4.132.22","DESKTOP-P07SKIO","TCP","1514","https(443)  >  55819 [ACK] Seq=91261 Ack=1 Win=32 Len=1460 [TCP segment of a reassembled PDU]"
"82","0.123396","101.4.132.22","DESKTOP-P07SKIO","TCP","1514","https(443)  >  55819 [ACK] Seq=92721 Ack=1 Win=32 Len=1460 [TCP segment of a reassembled PDU]"
"83","0.123399","101.4.132.22","DESKTOP-P07SKIO","TLSv1.2","749","Application Data"
"84","0.123403","116.211.94.3","DESKTOP-P07SKIO","TCP","60","https(443)  >  55903 [ACK] Seq=1 Ack=1163 Win=137 Len=0"
"85","0.123406","101.4.132.22","DESKTOP-P07SKIO","TCP","1514","https(443)  >  55819 [ACK] Seq=94876 Ack=1 Win=32 Len=1460 [TCP segment of a reassembled PDU]"
"86","0.123410","101.4.132.22","DESKTOP-P07SKIO","TCP","1514","https(443)  >  55819 [ACK] Seq=96336 Ack=1 Win=32 Len=1460 [TCP segment of a reassembled PDU]"
"87","0.123413","101.4.132.22","DESKTOP-P07SKIO","TLSv1.2","1514","Application Data [TCP segment of a reassembled PDU]"
"88","0.123417","101.4.132.22","DESKTOP-P07SKIO","TCP","1514","https(443)  >  55819 [ACK] Seq=99256 Ack=1 Win=32 Len=1460 [TCP segment of a reassembled PDU]"
"89","0.123422","101.4.132.22","DESKTOP-P07SKIO","TCP","1514","https(443)  >  55819 [ACK] Seq=100716 Ack=1 Win=32 Len=1460 [TCP segment of a reassembled PDU]"
"90","0.123429","101.4.132.22","DESKTOP-P07SKIO","TLSv1.2","1514","Application Data [TCP segment of a reassembled PDU]"
"91","0.123433","101.4.132.22","DESKTOP-P07SKIO","TCP","1514","https(443)  >  55819 [ACK] Seq=103636 Ack=1 Win=32 Len=1460 [TCP segment of a reassembled PDU]"
"92","0.123438","101.4.132.22","DESKTOP-P07SKIO","TCP","1514","https(443)  >  55819 [ACK] Seq=105096 Ack=1 Win=32 Len=1460 [TCP segment of a reassembled PDU]"
"93","0.123443","101.4.132.22","DESKTOP-P07SKIO","TLSv1.2","1514","Application Data [TCP segment of a reassembled PDU]"
"94","0.123451","101.4.132.22","DESKTOP-P07SKIO","TCP","1514","https(443)  >  55819 [ACK] Seq=108016 Ack=1 Win=32 Len=1460 [TCP segment of a reassembled PDU]"
"95","0.123454","101.4.132.22","DESKTOP-P07SKIO","TCP","1514","https(443)  >  55819 [ACK] Seq=109476 Ack=1 Win=32 Len=1460 [TCP segment of a reassembled PDU]"
"96","0.123457","101.4.132.22","DESKTOP-P07SKIO","TLSv1.2","1514","Application Data [TCP segment of a reassembled PDU]"
"97","0.123461","101.4.132.22","DESKTOP-P07SKIO","TCP","1514","https(443)  >  55819 [ACK] Seq=112396 Ack=1 Win=32 Len=1460 [TCP segment of a reassembled PDU]"
"98","0.123465","101.4.132.22","DESKTOP-P07SKIO","TCP","1514","https(443)  >  55819 [ACK] Seq=113856 Ack=1 Win=32 Len=1460 [TCP segment of a reassembled PDU]"
"99","0.123468","101.4.132.22","DESKTOP-P07SKIO","TLSv1.2","1514","Application Data [TCP segment of a reassembled PDU]"
"100","0.123472","101.4.132.22","DESKTOP-P07SKIO","TCP","1514","https(443)  >  55819 [ACK] Seq=116776 Ack=1 Win=32 Len=1460 [TCP segment of a reassembled PDU]"
"101","0.123475","101.4.132.22","DESKTOP-P07SKIO","TLSv1.2","1444","Application Data"
"102","0.123479","101.4.132.22","DESKTOP-P07SKIO","TCP","1514","https(443)  >  55819 [ACK] Seq=119626 Ack=1 Win=32 Len=1460 [TCP segment of a reassembled PDU]"
"103","0.123482","101.4.132.22","DESKTOP-P07SKIO","TCP","1514","https(443)  >  55819 [ACK] Seq=121086 Ack=1 Win=32 Len=1460 [TCP segment of a reassembled PDU]"
"104","0.123485","101.4.132.22","DESKTOP-P07SKIO","TLSv1.2","1514","Application Data [TCP segment of a reassembled PDU]"
"105","0.123489","101.4.132.22","DESKTOP-P07SKIO","TCP","1514","https(443)  >  55819 [ACK] Seq=124006 Ack=1 Win=32 Len=1460 [TCP segment of a reassembled PDU]"
"106","0.123495","101.4.132.22","DESKTOP-P07SKIO","TCP","1514","https(443)  >  55819 [ACK] Seq=125466 Ack=1 Win=32 Len=1460 [TCP segment of a reassembled PDU]"
"107","0.124725","DESKTOP-P07SKIO","101.4.132.22","TCP","54","55819  >  https(443) [ACK] Seq=1 Ack=126926 Win=18580 Len=0"
"108","0.125187","101.4.132.22","DESKTOP-P07SKIO","TLSv1.2","1514","Application Data [TCP segment of a reassembled PDU]"
"109","0.125201","101.4.132.22","DESKTOP-P07SKIO","TCP","1514","https(443)  >  55819 [ACK] Seq=128386 Ack=1 Win=32 Len=1460 [TCP segment of a reassembled PDU]"
"110","0.125209","101.4.132.22","DESKTOP-P07SKIO","TCP","1514","https(443)  >  55819 [ACK] Seq=129846 Ack=1 Win=32 Len=1460 [TCP segment of a reassembled PDU]"
"111","0.125212","101.4.132.22","DESKTOP-P07SKIO","TLSv1.2","749","Application Data"
"112","0.125496","DESKTOP-P07SKIO","101.4.132.22","TCP","54","55819  >  https(443) [ACK] Seq=1 Ack=132001 Win=18580 Len=0"
"113","0.159276","116.211.94.3","DESKTOP-P07SKIO","TCP","60","https(443)  >  55907 [ACK] Seq=1 Ack=1161 Win=97 Len=0"
"114","0.174722","192.144.198.149","DESKTOP-P07SKIO","TLSv1.2","128","Application Data"
"115","0.174735","192.144.198.149","DESKTOP-P07SKIO","TLSv1.2","153","Application Data"
"116","0.174951","DESKTOP-P07SKIO","192.144.198.149","TCP","54","55911  >  7823 [ACK] Seq=1162 Ack=469 Win=515 Len=0"
"117","0.177490","116.211.94.3","DESKTOP-P07SKIO","TLSv1.2","593","Application Data"
"118","0.181257","DESKTOP-P07SKIO","192.144.198.149","TLSv1.2","122","Application Data"
"119","0.183698","116.211.94.3","DESKTOP-P07SKIO","TLSv1.2","593","Application Data"
"120","0.206084","101.4.132.22","DESKTOP-P07SKIO","TCP","1514","https(443)  >  55819 [ACK] Seq=132001 Ack=1 Win=32 Len=1460 [TCP segment of a reassembled PDU]"
"121","0.207127","101.4.132.22","DESKTOP-P07SKIO","TCP","1514","https(443)  >  55819 [ACK] Seq=133461 Ack=1 Win=32 Len=1460 [TCP segment of a reassembled PDU]"
"122","0.207140","101.4.132.22","DESKTOP-P07SKIO","TLSv1.2","1259","Application Data"
"123","0.207143","101.4.132.22","DESKTOP-P07SKIO","TCP","1514","https(443)  >  55819 [ACK] Seq=136126 Ack=1 Win=32 Len=1460 [TCP segment of a reassembled PDU]"
"124","0.207146","101.4.132.22","DESKTOP-P07SKIO","TCP","1514","https(443)  >  55819 [ACK] Seq=137586 Ack=1 Win=32 Len=1460 [TCP segment of a reassembled PDU]"
"125","0.207150","101.4.132.22","DESKTOP-P07SKIO","TLSv1.2","1259","Application Data"
"126","0.207153","101.4.132.22","DESKTOP-P07SKIO","TCP","1514","https(443)  >  55819 [ACK] Seq=140251 Ack=1 Win=32 Len=1460 [TCP segment of a reassembled PDU]"
"127","0.207156","101.4.132.22","DESKTOP-P07SKIO","TCP","1514","https(443)  >  55819 [ACK] Seq=141711 Ack=1 Win=32 Len=1460 [TCP segment of a reassembled PDU]"
"128","0.207158","101.4.132.22","DESKTOP-P07SKIO","TLSv1.2","1514","Application Data [TCP segment of a reassembled PDU]"
"129","0.207160","101.4.132.22","DESKTOP-P07SKIO","TCP","1514","https(443)  >  55819 [ACK] Seq=144631 Ack=1 Win=32 Len=1460 [TCP segment of a reassembled PDU]"
"130","0.207163","101.4.132.22","DESKTOP-P07SKIO","TCP","1514","https(443)  >  55819 [ACK] Seq=146091 Ack=1 Win=32 Len=1460 [TCP segment of a reassembled PDU]"
"131","0.207166","101.4.132.22","DESKTOP-P07SKIO","TLSv1.2","1004","Application Data"
"132","0.207579","DESKTOP-P07SKIO","101.4.132.22","TCP","54","55819  >  https(443) [ACK] Seq=1 Ack=148501 Win=18580 Len=0"
"133","0.209325","101.4.132.22","DESKTOP-P07SKIO","TCP","1514","https(443)  >  55819 [ACK] Seq=148501 Ack=1 Win=32 Len=1460 [TCP segment of a reassembled PDU]"
"134","0.209343","101.4.132.22","DESKTOP-P07SKIO","TCP","1514","https(443)  >  55819 [ACK] Seq=149961 Ack=1 Win=32 Len=1460 [TCP segment of a reassembled PDU]"
"135","0.209347","101.4.132.22","DESKTOP-P07SKIO","TLSv1.2","1514","Application Data [TCP segment of a reassembled PDU]"
"136","0.209353","101.4.132.22","DESKTOP-P07SKIO","TCP","1514","https(443)  >  55819 [ACK] Seq=152881 Ack=1 Win=32 Len=1460 [TCP segment of a reassembled PDU]"
"137","0.209357","101.4.132.22","DESKTOP-P07SKIO","TCP","1514","https(443)  >  55819 [ACK] Seq=154341 Ack=1 Win=32 Len=1460 [TCP segment of a reassembled PDU]"
"138","0.209361","101.4.132.22","DESKTOP-P07SKIO","TLSv1.2","1514","Application Data [TCP segment of a reassembled PDU]"
"139","0.209364","101.4.132.22","DESKTOP-P07SKIO","TCP","1514","https(443)  >  55819 [ACK] Seq=157261 Ack=1 Win=32 Len=1460 [TCP segment of a reassembled PDU]"
"140","0.209368","101.4.132.22","DESKTOP-P07SKIO","TCP","1514","https(443)  >  55819 [ACK] Seq=158721 Ack=1 Win=32 Len=1460 [TCP segment of a reassembled PDU]"
"141","0.209373","101.4.132.22","DESKTOP-P07SKIO","TLSv1.2","1514","Application Data [TCP segment of a reassembled PDU]"
"142","0.209376","101.4.132.22","DESKTOP-P07SKIO","TCP","1514","https(443)  >  55819 [ACK] Seq=161641 Ack=1 Win=32 Len=1460 [TCP segment of a reassembled PDU]"
"143","0.209381","101.4.132.22","DESKTOP-P07SKIO","TCP","1514","https(443)  >  55819 [ACK] Seq=163101 Ack=1 Win=32 Len=1460 [TCP segment of a reassembled PDU]"
"144","0.209384","101.4.132.22","DESKTOP-P07SKIO","TLSv1.2","494","Application Data"
"145","0.209388","101.4.132.22","DESKTOP-P07SKIO","TCP","1514","https(443)  >  55819 [ACK] Seq=165001 Ack=1 Win=32 Len=1460 [TCP segment of a reassembled PDU]"
"146","0.209392","101.4.132.22","DESKTOP-P07SKIO","TCP","1514","https(443)  >  55819 [ACK] Seq=166461 Ack=1 Win=32 Len=1460 [TCP segment of a reassembled PDU]"
"147","0.209397","101.4.132.22","DESKTOP-P07SKIO","TLSv1.2","1514","Application Data [TCP segment of a reassembled PDU]"
"148","0.209400","101.4.132.22","DESKTOP-P07SKIO","TCP","1514","https(443)  >  55819 [ACK] Seq=169381 Ack=1 Win=32 Len=1460 [TCP segment of a reassembled PDU]"
"149","0.209405","101.4.132.22","DESKTOP-P07SKIO","TCP","1514","https(443)  >  55819 [ACK] Seq=170841 Ack=1 Win=32 Len=1460 [TCP segment of a reassembled PDU]"
"150","0.209409","101.4.132.22","DESKTOP-P07SKIO","TLSv1.2","1514","Application Data [TCP segment of a reassembled PDU]"
"151","0.209413","101.4.132.22","DESKTOP-P07SKIO","TCP","1514","https(443)  >  55819 [ACK] Seq=173761 Ack=1 Win=32 Len=1460 [TCP segment of a reassembled PDU]"
"152","0.209417","101.4.132.22","DESKTOP-P07SKIO","TCP","1514","https(443)  >  55819 [ACK] Seq=175221 Ack=1 Win=32 Len=1460 [TCP segment of a reassembled PDU]"
"153","0.209425","101.4.132.22","DESKTOP-P07SKIO","TLSv1.2","1514","Application Data [TCP segment of a reassembled PDU]"
"154","0.209429","101.4.132.22","DESKTOP-P07SKIO","TCP","1514","https(443)  >  55819 [ACK] Seq=178141 Ack=1 Win=32 Len=1460 [TCP segment of a reassembled PDU]"
"155","0.209433","101.4.132.22","DESKTOP-P07SKIO","TCP","1514","https(443)  >  55819 [ACK] Seq=179601 Ack=1 Win=32 Len=1460 [TCP segment of a reassembled PDU]"
"156","0.209437","101.4.132.22","DESKTOP-P07SKIO","TLSv1.2","1514","Application Data [TCP segment of a reassembled PDU]"
"157","0.209442","101.4.132.22","DESKTOP-P07SKIO","TCP","1514","https(443)  >  55819 [ACK] Seq=182521 Ack=1 Win=32 Len=1460 [TCP segment of a reassembled PDU]"
"158","0.209446","101.4.132.22","DESKTOP-P07SKIO","TCP","1514","https(443)  >  55819 [ACK] Seq=183981 Ack=1 Win=32 Len=1460 [TCP segment of a reassembled PDU]"
"159","0.209451","101.4.132.22","DESKTOP-P07SKIO","TLSv1.2","1514","Application Data [TCP segment of a reassembled PDU]"
"160","0.209454","101.4.132.22","DESKTOP-P07SKIO","TCP","1514","https(443)  >  55819 [ACK] Seq=186901 Ack=1 Win=32 Len=1460 [TCP segment of a reassembled PDU]"
"161","0.209458","101.4.132.22","DESKTOP-P07SKIO","TLSv1.2","1514","Application Data [TCP segment of a reassembled PDU]"
"162","0.209461","101.4.132.22","DESKTOP-P07SKIO","TCP","1514","https(443)  >  55819 [ACK] Seq=189821 Ack=1 Win=32 Len=1460 [TCP segment of a reassembled PDU]"
"163","0.209465","101.4.132.22","DESKTOP-P07SKIO","TCP","1514","https(443)  >  55819 [ACK] Seq=191281 Ack=1 Win=32 Len=1460 [TCP segment of a reassembled PDU]"
"164","0.209468","101.4.132.22","DESKTOP-P07SKIO","TLSv1.2","1189","Application Data"
"165","0.210777","DESKTOP-P07SKIO","101.4.132.22","TCP","54","55819  >  https(443) [ACK] Seq=1 Ack=193876 Win=18580 Len=0"
"166","0.211222","101.4.132.22","DESKTOP-P07SKIO","TCP","1514","https(443)  >  55819 [ACK] Seq=193876 Ack=1 Win=32 Len=1460 [TCP segment of a reassembled PDU]"
"167","0.211236","101.4.132.22","DESKTOP-P07SKIO","TCP","1514","https(443)  >  55819 [ACK] Seq=195336 Ack=1 Win=32 Len=1460 [TCP segment of a reassembled PDU]"
"168","0.211241","101.4.132.22","DESKTOP-P07SKIO","TLSv1.2","1259","Application Data"
"169","0.211469","DESKTOP-P07SKIO","101.4.132.22","TCP","54","55819  >  https(443) [ACK] Seq=1 Ack=198001 Win=18580 Len=0"
"170","0.219252","DESKTOP-P07SKIO","116.211.94.3","TCP","54","55907  >  https(443) [ACK] Seq=1161 Ack=540 Win=508 Len=0"
"171","0.224457","DESKTOP-P07SKIO","116.211.94.3","TCP","54","55903  >  https(443) [ACK] Seq=1163 Ack=540 Win=513 Len=0"
"172","0.239342","192.144.198.149","DESKTOP-P07SKIO","TLSv1.2","105","Application Data"
"173","0.283428","DESKTOP-P07SKIO","192.144.198.149","TCP","54","55911  >  7823 [ACK] Seq=1230 Ack=520 Win=515 Len=0"
"174","0.294115","101.4.132.22","DESKTOP-P07SKIO","TCP","1514","https(443)  >  55819 [ACK] Seq=198001 Ack=1 Win=32 Len=1460 [TCP segment of a reassembled PDU]"
"175","0.295384","101.4.132.22","DESKTOP-P07SKIO","TCP","1514","https(443)  >  55819 [ACK] Seq=199461 Ack=1 Win=32 Len=1460 [TCP segment of a reassembled PDU]"
"176","0.295397","101.4.132.22","DESKTOP-P07SKIO","TLSv1.2","1259","Application Data"
"177","0.295403","101.4.132.22","DESKTOP-P07SKIO","TCP","1514","https(443)  >  55819 [ACK] Seq=202126 Ack=1 Win=32 Len=1460 [TCP segment of a reassembled PDU]"
"178","0.295407","101.4.132.22","DESKTOP-P07SKIO","TCP","1514","https(443)  >  55819 [ACK] Seq=203586 Ack=1 Win=32 Len=1460 [TCP segment of a reassembled PDU]"
"179","0.295411","101.4.132.22","DESKTOP-P07SKIO","TLSv1.2","1259","Application Data"
"180","0.295415","101.4.132.22","DESKTOP-P07SKIO","TCP","1514","https(443)  >  55819 [ACK] Seq=206251 Ack=1 Win=32 Len=1460 [TCP segment of a reassembled PDU]"
"181","0.295419","101.4.132.22","DESKTOP-P07SKIO","TCP","1514","https(443)  >  55819 [ACK] Seq=207711 Ack=1 Win=32 Len=1460 [TCP segment of a reassembled PDU]"
"182","0.295423","101.4.132.22","DESKTOP-P07SKIO","TLSv1.2","1514","Application Data [TCP segment of a reassembled PDU]"
"183","0.295427","101.4.132.22","DESKTOP-P07SKIO","TCP","1514","https(443)  >  55819 [ACK] Seq=210631 Ack=1 Win=32 Len=1460 [TCP segment of a reassembled PDU]"
"184","0.295431","101.4.132.22","DESKTOP-P07SKIO","TCP","1514","https(443)  >  55819 [ACK] Seq=212091 Ack=1 Win=32 Len=1460 [TCP segment of a reassembled PDU]"
"185","0.295437","101.4.132.22","DESKTOP-P07SKIO","TLSv1.2","1004","Application Data"
"186","0.295928","DESKTOP-P07SKIO","101.4.132.22","TCP","54","55819  >  https(443) [ACK] Seq=1 Ack=214501 Win=18580 Len=0"
"187","0.297449","101.4.132.22","DESKTOP-P07SKIO","TCP","1514","https(443)  >  55819 [ACK] Seq=214501 Ack=1 Win=32 Len=1460 [TCP segment of a reassembled PDU]"
"188","0.297461","101.4.132.22","DESKTOP-P07SKIO","TCP","1514","https(443)  >  55819 [ACK] Seq=215961 Ack=1 Win=32 Len=1460 [TCP segment of a reassembled PDU]"
"189","0.297466","101.4.132.22","DESKTOP-P07SKIO","TLSv1.2","1514","Application Data [TCP segment of a reassembled PDU]"
"190","0.297470","101.4.132.22","DESKTOP-P07SKIO","TCP","1514","https(443)  >  55819 [ACK] Seq=218881 Ack=1 Win=32 Len=1460 [TCP segment of a reassembled PDU]"
"191","0.297474","101.4.132.22","DESKTOP-P07SKIO","TCP","1514","https(443)  >  55819 [ACK] Seq=220341 Ack=1 Win=32 Len=1460 [TCP segment of a reassembled PDU]"
"192","0.297477","101.4.132.22","DESKTOP-P07SKIO","TLSv1.2","1514","Application Data [TCP segment of a reassembled PDU]"
"193","0.297483","101.4.132.22","DESKTOP-P07SKIO","TCP","1514","https(443)  >  55819 [ACK] Seq=223261 Ack=1 Win=32 Len=1460 [TCP segment of a reassembled PDU]"
"194","0.297487","101.4.132.22","DESKTOP-P07SKIO","TCP","1514","https(443)  >  55819 [ACK] Seq=224721 Ack=1 Win=32 Len=1460 [TCP segment of a reassembled PDU]"
"195","0.297491","101.4.132.22","DESKTOP-P07SKIO","TLSv1.2","749","Application Data"
"196","0.297494","101.4.132.22","DESKTOP-P07SKIO","TCP","1514","https(443)  >  55819 [ACK] Seq=226876 Ack=1 Win=32 Len=1460 [TCP segment of a reassembled PDU]"
"197","0.297499","101.4.132.22","DESKTOP-P07SKIO","TCP","1514","https(443)  >  55819 [ACK] Seq=228336 Ack=1 Win=32 Len=1460 [TCP segment of a reassembled PDU]"
"198","0.297503","101.4.132.22","DESKTOP-P07SKIO","TLSv1.2","1514","Application Data [TCP segment of a reassembled PDU]"
"199","0.297507","101.4.132.22","DESKTOP-P07SKIO","TCP","1514","https(443)  >  55819 [ACK] Seq=231256 Ack=1 Win=32 Len=1460 [TCP segment of a reassembled PDU]"
"200","0.297510","101.4.132.22","DESKTOP-P07SKIO","TCP","1514","https(443)  >  55819 [ACK] Seq=232716 Ack=1 Win=32 Len=1460 [TCP segment of a reassembled PDU]"
"201","0.297514","101.4.132.22","DESKTOP-P07SKIO","TLSv1.2","1514","Application Data [TCP segment of a reassembled PDU]"
"202","0.297518","101.4.132.22","DESKTOP-P07SKIO","TCP","1514","https(443)  >  55819 [ACK] Seq=235636 Ack=1 Win=32 Len=1460 [TCP segment of a reassembled PDU]"
"203","0.297522","101.4.132.22","DESKTOP-P07SKIO","TCP","1514","https(443)  >  55819 [ACK] Seq=237096 Ack=1 Win=32 Len=1460 [TCP segment of a reassembled PDU]"
"204","0.297525","101.4.132.22","DESKTOP-P07SKIO","TLSv1.2","1514","Application Data [TCP segment of a reassembled PDU]"
"205","0.297529","101.4.132.22","DESKTOP-P07SKIO","TCP","1514","https(443)  >  55819 [ACK] Seq=240016 Ack=1 Win=32 Len=1460 [TCP segment of a reassembled PDU]"
"206","0.297534","101.4.132.22","DESKTOP-P07SKIO","TCP","1514","https(443)  >  55819 [ACK] Seq=241476 Ack=1 Win=32 Len=1460 [TCP segment of a reassembled PDU]"
"207","0.297538","101.4.132.22","DESKTOP-P07SKIO","TLSv1.2","1514","Application Data [TCP segment of a reassembled PDU]"
"208","0.297542","101.4.132.22","DESKTOP-P07SKIO","TCP","1514","https(443)  >  55819 [ACK] Seq=244396 Ack=1 Win=32 Len=1460 [TCP segment of a reassembled PDU]"
"209","0.297547","101.4.132.22","DESKTOP-P07SKIO","TCP","1514","https(443)  >  55819 [ACK] Seq=245856 Ack=1 Win=32 Len=1460 [TCP segment of a reassembled PDU]"
"210","0.297550","101.4.132.22","DESKTOP-P07SKIO","TLSv1.2","1514","Application Data [TCP segment of a reassembled PDU]"
"211","0.297555","101.4.132.22","DESKTOP-P07SKIO","TCP","1514","https(443)  >  55819 [ACK] Seq=248776 Ack=1 Win=32 Len=1460 [TCP segment of a reassembled PDU]"
"212","0.297559","101.4.132.22","DESKTOP-P07SKIO","TLSv1.2","1444","Application Data"
"213","0.298484","DESKTOP-P07SKIO","101.4.132.22","TCP","54","55819  >  https(443) [ACK] Seq=1 Ack=251626 Win=18580 Len=0"
"214","0.298781","101.4.132.22","DESKTOP-P07SKIO","TCP","1514","https(443)  >  55819 [ACK] Seq=251626 Ack=1 Win=32 Len=1460 [TCP segment of a reassembled PDU]"
"215","0.298796","101.4.132.22","DESKTOP-P07SKIO","TCP","1514","https(443)  >  55819 [ACK] Seq=253086 Ack=1 Win=32 Len=1460 [TCP segment of a reassembled PDU]"
"216","0.298800","101.4.132.22","DESKTOP-P07SKIO","TLSv1.2","1514","Application Data [TCP segment of a reassembled PDU]"
"217","0.298804","101.4.132.22","DESKTOP-P07SKIO","TCP","1514","https(443)  >  55819 [ACK] Seq=256006 Ack=1 Win=32 Len=1460 [TCP segment of a reassembled PDU]"
"218","0.298808","101.4.132.22","DESKTOP-P07SKIO","TCP","1514","https(443)  >  55819 [ACK] Seq=257466 Ack=1 Win=32 Len=1460 [TCP segment of a reassembled PDU]"
"219","0.298812","101.4.132.22","DESKTOP-P07SKIO","TLSv1.2","1514","Application Data [TCP segment of a reassembled PDU]"
"220","0.298816","101.4.132.22","DESKTOP-P07SKIO","TCP","1514","https(443)  >  55819 [ACK] Seq=260386 Ack=1 Win=32 Len=1460 [TCP segment of a reassembled PDU]"
"221","0.298819","101.4.132.22","DESKTOP-P07SKIO","TCP","1514","https(443)  >  55819 [ACK] Seq=261846 Ack=1 Win=32 Len=1460 [TCP segment of a reassembled PDU]"
"222","0.298833","101.4.132.22","DESKTOP-P07SKIO","TLSv1.2","749","Application Data"
"223","0.299343","DESKTOP-P07SKIO","101.4.132.22","TCP","54","55819  >  https(443) [ACK] Seq=1 Ack=264001 Win=18580 Len=0"
"224","0.384081","101.4.132.22","DESKTOP-P07SKIO","TCP","1514","https(443)  >  55819 [ACK] Seq=264001 Ack=1 Win=32 Len=1460 [TCP segment of a reassembled PDU]"
"225","0.384094","101.4.132.22","DESKTOP-P07SKIO","TCP","1514","https(443)  >  55819 [ACK] Seq=265461 Ack=1 Win=32 Len=1460 [TCP segment of a reassembled PDU]"
"226","0.384097","101.4.132.22","DESKTOP-P07SKIO","TLSv1.2","1259","Application Data"
"227","0.384101","101.4.132.22","DESKTOP-P07SKIO","TCP","1514","https(443)  >  55819 [ACK] Seq=268126 Ack=1 Win=32 Len=1460 [TCP segment of a reassembled PDU]"
"228","0.384104","101.4.132.22","DESKTOP-P07SKIO","TCP","1514","https(443)  >  55819 [ACK] Seq=269586 Ack=1 Win=32 Len=1460 [TCP segment of a reassembled PDU]"
"229","0.384107","101.4.132.22","DESKTOP-P07SKIO","TLSv1.2","1259","Application Data"
"230","0.384110","101.4.132.22","DESKTOP-P07SKIO","TCP","1514","https(443)  >  55819 [ACK] Seq=272251 Ack=1 Win=32 Len=1460 [TCP segment of a reassembled PDU]"
"231","0.384116","101.4.132.22","DESKTOP-P07SKIO","TCP","1514","https(443)  >  55819 [ACK] Seq=273711 Ack=1 Win=32 Len=1460 [TCP segment of a reassembled PDU]"
"232","0.384119","101.4.132.22","DESKTOP-P07SKIO","TLSv1.2","1514","Application Data [TCP segment of a reassembled PDU]"
"233","0.384121","101.4.132.22","DESKTOP-P07SKIO","TCP","1514","https(443)  >  55819 [ACK] Seq=276631 Ack=1 Win=32 Len=1460 [TCP segment of a reassembled PDU]"
"234","0.384124","101.4.132.22","DESKTOP-P07SKIO","TCP","1514","https(443)  >  55819 [ACK] Seq=278091 Ack=1 Win=32 Len=1460 [TCP segment of a reassembled PDU]"
"235","0.384139","101.4.132.22","DESKTOP-P07SKIO","TLSv1.2","1004","Application Data"
"236","0.384142","101.4.132.22","DESKTOP-P07SKIO","TCP","1514","https(443)  >  55819 [ACK] Seq=280501 Ack=1 Win=32 Len=1460 [TCP segment of a reassembled PDU]"
"237","0.384145","101.4.132.22","DESKTOP-P07SKIO","TCP","1514","https(443)  >  55819 [ACK] Seq=281961 Ack=1 Win=32 Len=1460 [TCP segment of a reassembled PDU]"
"238","0.384147","101.4.132.22","DESKTOP-P07SKIO","TLSv1.2","1259","Application Data"
"239","0.384151","101.4.132.22","DESKTOP-P07SKIO","TCP","1514","https(443)  >  55819 [ACK] Seq=284626 Ack=1 Win=32 Len=1460 [TCP segment of a reassembled PDU]"
"240","0.384154","101.4.132.22","DESKTOP-P07SKIO","TCP","1514","https(443)  >  55819 [ACK] Seq=286086 Ack=1 Win=32 Len=1460 [TCP segment of a reassembled PDU]"
"241","0.384156","101.4.132.22","DESKTOP-P07SKIO","TLSv1.2","1514","Application Data [TCP segment of a reassembled PDU]"
"242","0.384158","101.4.132.22","DESKTOP-P07SKIO","TCP","1514","https(443)  >  55819 [ACK] Seq=289006 Ack=1 Win=32 Len=1460 [TCP segment of a reassembled PDU]"
"243","0.384161","101.4.132.22","DESKTOP-P07SKIO","TCP","1514","https(443)  >  55819 [ACK] Seq=290466 Ack=1 Win=32 Len=1460 [TCP segment of a reassembled PDU]"
"244","0.384165","101.4.132.22","DESKTOP-P07SKIO","TLSv1.2","1514","Application Data [TCP segment of a reassembled PDU]"
"245","0.384168","101.4.132.22","DESKTOP-P07SKIO","TCP","1514","https(443)  >  55819 [ACK] Seq=293386 Ack=1 Win=32 Len=1460 [TCP segment of a reassembled PDU]"
"246","0.384171","101.4.132.22","DESKTOP-P07SKIO","TCP","1514","https(443)  >  55819 [ACK] Seq=294846 Ack=1 Win=32 Len=1460 [TCP segment of a reassembled PDU]"
"247","0.384179","101.4.132.22","DESKTOP-P07SKIO","TLSv1.2","1514","Application Data [TCP segment of a reassembled PDU]"
"248","0.384181","101.4.132.22","DESKTOP-P07SKIO","TCP","1514","https(443)  >  55819 [ACK] Seq=297766 Ack=1 Win=32 Len=1460 [TCP segment of a reassembled PDU]"
"249","0.384184","101.4.132.22","DESKTOP-P07SKIO","TCP","1514","https(443)  >  55819 [ACK] Seq=299226 Ack=1 Win=32 Len=1460 [TCP segment of a reassembled PDU]"
"250","0.384187","101.4.132.22","DESKTOP-P07SKIO","TLSv1.2","494","Application Data"
"251","0.384189","101.4.132.22","DESKTOP-P07SKIO","TCP","1514","https(443)  >  55819 [ACK] Seq=301126 Ack=1 Win=32 Len=1460 [TCP segment of a reassembled PDU]"
"252","0.384191","101.4.132.22","DESKTOP-P07SKIO","TCP","1514","https(443)  >  55819 [ACK] Seq=302586 Ack=1 Win=32 Len=1460 [TCP segment of a reassembled PDU]"
"253","0.384194","101.4.132.22","DESKTOP-P07SKIO","TLSv1.2","1514","Application Data [TCP segment of a reassembled PDU]"
"254","0.385089","DESKTOP-P07SKIO","101.4.132.22","TCP","54","55819  >  https(443) [ACK] Seq=1 Ack=305506 Win=18580 Len=0"
"255","0.386571","101.4.132.22","DESKTOP-P07SKIO","TCP","1514","https(443)  >  55819 [ACK] Seq=305506 Ack=1 Win=32 Len=1460 [TCP segment of a reassembled PDU]"
"256","0.386587","101.4.132.22","DESKTOP-P07SKIO","TCP","1514","https(443)  >  55819 [ACK] Seq=306966 Ack=1 Win=32 Len=1460 [TCP segment of a reassembled PDU]"
"257","0.386591","101.4.132.22","DESKTOP-P07SKIO","TLSv1.2","1514","Application Data [TCP segment of a reassembled PDU]"
"258","0.386594","101.4.132.22","DESKTOP-P07SKIO","TCP","1514","https(443)  >  55819 [ACK] Seq=309886 Ack=1 Win=32 Len=1460 [TCP segment of a reassembled PDU]"
"259","0.386599","101.4.132.22","DESKTOP-P07SKIO","TCP","1514","https(443)  >  55819 [ACK] Seq=311346 Ack=1 Win=32 Len=1460 [TCP segment of a reassembled PDU]"
"260","0.386602","101.4.132.22","DESKTOP-P07SKIO","TLSv1.2","1514","Application Data [TCP segment of a reassembled PDU]"
"261","0.386605","101.4.132.22","DESKTOP-P07SKIO","TCP","1514","https(443)  >  55819 [ACK] Seq=314266 Ack=1 Win=32 Len=1460 [TCP segment of a reassembled PDU]"
"262","0.386609","101.4.132.22","DESKTOP-P07SKIO","TCP","1514","https(443)  >  55819 [ACK] Seq=315726 Ack=1 Win=32 Len=1460 [TCP segment of a reassembled PDU]"
"263","0.386615","101.4.132.22","DESKTOP-P07SKIO","TLSv1.2","1514","Application Data [TCP segment of a reassembled PDU]"
"264","0.386618","101.4.132.22","DESKTOP-P07SKIO","TCP","1514","https(443)  >  55819 [ACK] Seq=318646 Ack=1 Win=32 Len=1460 [TCP segment of a reassembled PDU]"
"265","0.386622","101.4.132.22","DESKTOP-P07SKIO","TCP","1514","https(443)  >  55819 [ACK] Seq=320106 Ack=1 Win=32 Len=1460 [TCP segment of a reassembled PDU]"
"266","0.386626","101.4.132.22","DESKTOP-P07SKIO","TLSv1.2","1514","Application Data [TCP segment of a reassembled PDU]"
"267","0.386629","101.4.132.22","DESKTOP-P07SKIO","TCP","1514","https(443)  >  55819 [ACK] Seq=323026 Ack=1 Win=32 Len=1460 [TCP segment of a reassembled PDU]"
"268","0.386634","101.4.132.22","DESKTOP-P07SKIO","TLSv1.2","1514","Application Data [TCP segment of a reassembled PDU]"
"269","0.386637","101.4.132.22","DESKTOP-P07SKIO","TCP","1514","https(443)  >  55819 [ACK] Seq=325946 Ack=1 Win=32 Len=1460 [TCP segment of a reassembled PDU]"
"270","0.386641","101.4.132.22","DESKTOP-P07SKIO","TCP","1514","https(443)  >  55819 [ACK] Seq=327406 Ack=1 Win=32 Len=1460 [TCP segment of a reassembled PDU]"
"271","0.386645","101.4.132.22","DESKTOP-P07SKIO","TLSv1.2","1189","Application Data"
"272","0.387292","DESKTOP-P07SKIO","101.4.132.22","TCP","54","55819  >  https(443) [ACK] Seq=1 Ack=330001 Win=18580 Len=0"
"273","0.470206","101.4.132.22","DESKTOP-P07SKIO","TCP","1514","https(443)  >  55819 [ACK] Seq=330001 Ack=1 Win=32 Len=1460 [TCP segment of a reassembled PDU]"
"274","0.471470","101.4.132.22","DESKTOP-P07SKIO","TCP","1514","https(443)  >  55819 [ACK] Seq=331461 Ack=1 Win=32 Len=1460 [TCP segment of a reassembled PDU]"
"275","0.471483","101.4.132.22","DESKTOP-P07SKIO","TLSv1.2","1259","Application Data"
"276","0.471486","101.4.132.22","DESKTOP-P07SKIO","TCP","1514","https(443)  >  55819 [ACK] Seq=334126 Ack=1 Win=32 Len=1460 [TCP segment of a reassembled PDU]"
"277","0.471490","101.4.132.22","DESKTOP-P07SKIO","TCP","1514","https(443)  >  55819 [ACK] Seq=335586 Ack=1 Win=32 Len=1460 [TCP segment of a reassembled PDU]"
"278","0.471493","101.4.132.22","DESKTOP-P07SKIO","TLSv1.2","1259","Application Data"
"279","0.471495","101.4.132.22","DESKTOP-P07SKIO","TCP","1514","https(443)  >  55819 [ACK] Seq=338251 Ack=1 Win=32 Len=1460 [TCP segment of a reassembled PDU]"
"280","0.471500","101.4.132.22","DESKTOP-P07SKIO","TCP","1514","https(443)  >  55819 [ACK] Seq=339711 Ack=1 Win=32 Len=1460 [TCP segment of a reassembled PDU]"
"281","0.471503","101.4.132.22","DESKTOP-P07SKIO","TLSv1.2","1514","Application Data [TCP segment of a reassembled PDU]"
"282","0.471506","101.4.132.22","DESKTOP-P07SKIO","TCP","1514","https(443)  >  55819 [ACK] Seq=342631 Ack=1 Win=32 Len=1460 [TCP segment of a reassembled PDU]"
"283","0.471508","101.4.132.22","DESKTOP-P07SKIO","TCP","1514","https(443)  >  55819 [ACK] Seq=344091 Ack=1 Win=32 Len=1460 [TCP segment of a reassembled PDU]"
"284","0.471511","101.4.132.22","DESKTOP-P07SKIO","TLSv1.2","1004","Application Data"
"285","0.471513","101.4.132.22","DESKTOP-P07SKIO","TCP","1514","https(443)  >  55819 [ACK] Seq=346501 Ack=1 Win=32 Len=1460 [TCP segment of a reassembled PDU]"
"286","0.471971","DESKTOP-P07SKIO","101.4.132.22","TCP","54","55819  >  https(443) [ACK] Seq=1 Ack=347961 Win=18580 Len=0"
"287","0.474234","101.4.132.22","DESKTOP-P07SKIO","TCP","1514","https(443)  >  55819 [ACK] Seq=347961 Ack=1 Win=32 Len=1460 [TCP segment of a reassembled PDU]"
"288","0.474248","101.4.132.22","DESKTOP-P07SKIO","TLSv1.2","1514","Application Data [TCP segment of a reassembled PDU]"
"289","0.474252","101.4.132.22","DESKTOP-P07SKIO","TCP","1514","https(443)  >  55819 [ACK] Seq=350881 Ack=1 Win=32 Len=1460 [TCP segment of a reassembled PDU]"
"290","0.474256","101.4.132.22","DESKTOP-P07SKIO","TCP","1514","https(443)  >  55819 [ACK] Seq=352341 Ack=1 Win=32 Len=1460 [TCP segment of a reassembled PDU]"
